{
  "name": "tdd-red-green",
  "description": "Verify @tdd agent loads, enters Red phase (writes a failing test), then Green phase (writes minimal implementation to pass).",
  "agent": "@tdd",
  "input": "Write a function `add(a, b)` that returns the sum of two integers. Use TDD.",
  "expected_behavior": [
    "Agent reads existing code and test conventions before writing",
    "Agent writes exactly one failing test before implementation (Red phase)",
    "Agent confirms the test fails with a meaningful error, not a syntax error",
    "Agent writes minimal production code to pass the one test (Green phase)",
    "Agent confirms the full suite is green before proceeding",
    "Agent does not write speculative features or untested code"
  ],
  "pass_criteria": "all behaviors observed",
  "tags": ["smoke", "tdd", "critical"]
}
