{
  "name": "finding-duplicate-functions-two-phase",
  "description": "Verify finding-duplicate-functions runs both phases — structural scan then intent clustering — and applies the deletion-test gate before proposing extraction.",
  "agent": "finding-duplicate-functions",
  "input": "Scan backend/helpers.php and backend/utils.php for semantic duplicates. Both files contain functions that format dates but with different parameter names and ordering.",
  "expected_behavior": [
    "Agent announces using finding-duplicate-functions skill",
    "Agent runs Phase 1 structural scan (signature similarity, body structure)",
    "Agent runs Phase 2 intent clustering (same problem or different problems?)",
    "Agent applies the deletion test before any extraction proposal",
    "Agent outputs the three-section format: high-confidence, candidates, false positives",
    "Agent does NOT propose extraction for pairs under 5 lines",
    "Agent does NOT propose extraction where deletion test shows 'moves complexity sideways'"
  ],
  "pass_criteria": "all behaviors observed",
  "tags": ["smoke", "process", "architecture"]
}
