{
  "name": "oversized-brainstorming-wayfinder",
  "description": "Design routes established oversized work to wayfinder before detailed grilling.",
  "agent": "design",
  "input": "Design a large established-system change spanning several independent subsystems.",
  "expected_behavior": [
    "Agent performs the scope gate before detailed grilling",
    "Agent routes established or indeterminate oversized work only to wayfinder",
    "Agent does not create ad-hoc sub-project specs or invoke planning or TDD"
  ],
  "pass_criteria": "all behaviors observed",
  "tags": ["smoke", "brainstorming", "wayfinder"]
}
