{
    "name": "explore-uses-graph-when-present",
    "description": "Verify @explore prefers graphify query when a knowledge graph exists at graphify-out/graph.json.",
    "agent": "@explore",
    "input": "Where is EvalCase validated in the codebase? Look for validation logic.",
    "expected_behavior": [
        "Agent checks for graphify-out/graph.json before falling back to glob/grep",
        "Agent invokes graphify query via bash when graph exists",
        "Agent cites scoped subgraph results in its answer",
        "Agent does not rebuild the graph itself"
    ],
    "pass_criteria": "manual inspection required",
    "tags": ["smoke", "explore", "graphify"]
}
