{
    "name": "explore-falls-back-when-graph-absent",
    "description": "Verify @explore falls back to glob/grep/read when no knowledge graph exists.",
    "agent": "@explore",
    "input": "Where is EvalCase validated in the codebase?",
    "expected_behavior": [
        "Agent checks for graphify-out/graph.json and finds it absent",
        "Agent does not attempt to invoke graphify query",
        "Agent falls back to glob/grep/read workflow",
        "Agent provides a correct answer despite no graph"
    ],
    "pass_criteria": "manual inspection required",
    "tags": ["smoke", "explore", "graphify"]
}
